{
  "version": 1,
  "catalog": "public/assets/catalog/authoring-resources.json",
  "policy": {
    "rightsHolder": "Tomás Scorza",
    "proprietaryAssetLicense": "LicenseRef-Proprietary-Asset",
    "notices": "THIRD_PARTY_NOTICES.md"
  },
  "resources": [
    {
      "resourceId": "el-peque-v1",
      "assetType": "character",
      "origin": "original",
      "rightsHolder": "Tomás Scorza",
      "licenseExpression": "LicenseRef-Proprietary-Asset",
      "status": "cleared",
      "commercialUse": "allowed",
      "redistribution": "product-only",
      "attribution": { "required": false },
      "notes": "Recurso original cubierto por la licencia propietaria del producto; no se concede redistribución independiente."
    },
    {
      "resourceId": "mono-azul-v1",
      "assetType": "character",
      "origin": "original",
      "rightsHolder": "Tomás Scorza",
      "licenseExpression": "LicenseRef-Proprietary-Asset",
      "status": "cleared",
      "commercialUse": "allowed",
      "redistribution": "product-only",
      "attribution": { "required": false },
      "notes": "Definición geométrica original; redistribución permitida únicamente como parte del producto autorizado."
    },
    {
      "resourceId": "mono-ciruela-v1",
      "assetType": "character",
      "origin": "original",
      "rightsHolder": "Tomás Scorza",
      "licenseExpression": "LicenseRef-Proprietary-Asset",
      "status": "cleared",
      "commercialUse": "allowed",
      "redistribution": "product-only",
      "attribution": { "required": false },
      "notes": "Variante original del sistema paramétrico; no se autoriza su venta como asset independiente."
    },
    {
      "resourceId": "mono-verde-v1",
      "assetType": "character",
      "origin": "original",
      "rightsHolder": "Tomás Scorza",
      "licenseExpression": "LicenseRef-Proprietary-Asset",
      "status": "cleared",
      "commercialUse": "allowed",
      "redistribution": "product-only",
      "attribution": { "required": false },
      "notes": "Variante original del sistema paramétrico; no se autoriza su venta como asset independiente."
    },
    {
      "resourceId": "mono-teal-v1",
      "assetType": "character",
      "origin": "original",
      "rightsHolder": "Tomás Scorza",
      "licenseExpression": "LicenseRef-Proprietary-Asset",
      "status": "cleared",
      "commercialUse": "allowed",
      "redistribution": "product-only",
      "attribution": { "required": false },
      "notes": "Variante original del sistema paramétrico; no se autoriza su venta como asset independiente."
    },
    {
      "resourceId": "mono-terracota-v1",
      "assetType": "character",
      "origin": "original",
      "rightsHolder": "Tomás Scorza",
      "licenseExpression": "LicenseRef-Proprietary-Asset",
      "status": "cleared",
      "commercialUse": "allowed",
      "redistribution": "product-only",
      "attribution": { "required": false },
      "notes": "Variante original del sistema paramétrico; no se autoriza su venta como asset independiente."
    },
    {
      "resourceId": "mono-pizarra-v1",
      "assetType": "character",
      "origin": "original",
      "rightsHolder": "Tomás Scorza",
      "licenseExpression": "LicenseRef-Proprietary-Asset",
      "status": "cleared",
      "commercialUse": "allowed",
      "redistribution": "product-only",
      "attribution": { "required": false },
      "notes": "Variante original del sistema paramétrico; no se autoriza su venta como asset independiente."
    },
    {
      "resourceId": "tucan-gala-v1",
      "assetType": "character",
      "origin": "original",
      "rightsHolder": "Tomás Scorza",
      "licenseExpression": "LicenseRef-Proprietary-Asset",
      "status": "cleared",
      "commercialUse": "allowed",
      "redistribution": "product-only",
      "attribution": { "required": false },
      "notes": "Diseño geométrico original; no se autoriza su redistribución independiente."
    },
    {
      "resourceId": "conejo-traje-v1",
      "assetType": "character",
      "origin": "ai-assisted",
      "rightsHolder": "Usuario local; cadena de autoría pendiente de documentar",
      "licenseExpression": "LicenseRef-Authorship-Review",
      "status": "review-required",
      "commercialUse": "review-required",
      "redistribution": "review-required",
      "attribution": { "required": false },
      "notes": "La ficha vigente indica propuesta asistida por IA y creación local, pero no conserva modelo, términos ni evidencia suficiente para un release comercial."
    },
    {
      "resourceId": "mono-articulado-azul-v1",
      "assetType": "character",
      "origin": "original",
      "rightsHolder": "Tomás Scorza",
      "licenseExpression": "LicenseRef-Proprietary-Asset",
      "status": "cleared",
      "commercialUse": "allowed",
      "redistribution": "product-only",
      "attribution": { "required": false },
      "notes": "Rig articulado original; redistribución permitida únicamente como parte del producto autorizado."
    },
    {
      "resourceId": "voz-ald-mx-v1",
      "assetType": "voice",
      "origin": "third-party",
      "rightsHolder": "Contribuidores de Piper Voices y rmcpantoja",
      "sourceUrl": "https://huggingface.co/rhasspy/piper-voices/tree/main/es/es_MX/ald/medium",
      "licenseExpression": "MIT AND Unlicense",
      "licenseUrl": "https://unlicense.org/",
      "status": "cleared",
      "commercialUse": "allowed",
      "redistribution": "allowed-with-notice",
      "attribution": { "required": false },
      "notes": "El MODEL_CARD declara el dataset Ald Mexican Spanish bajo Unlicense; conservar también el aviso MIT del repositorio de modelos."
    },
    {
      "resourceId": "voz-claude-mx-v1",
      "assetType": "voice",
      "origin": "third-party",
      "rightsHolder": "Contribuidores de Piper Voices y HirCoir",
      "sourceUrl": "https://huggingface.co/rhasspy/piper-voices/tree/main/es/es_MX/claude/high",
      "licenseExpression": "MIT AND Apache-2.0",
      "licenseUrl": "https://www.apache.org/licenses/LICENSE-2.0",
      "status": "review-required",
      "commercialUse": "review-required",
      "redistribution": "review-required",
      "attribution": { "required": true, "text": "Modelo Claude de Piper Voices; dataset HirCoir Piper-TTS-Spanish, Apache-2.0." },
      "notes": "La licencia declarada es permisiva, pero falta cerrar la procedencia del audio base antes de distribuir o vender."
    },
    {
      "resourceId": "voz-sharvard-es-v1",
      "assetType": "voice",
      "origin": "third-party",
      "rightsHolder": "Contribuidores de Piper Voices y University of Edinburgh",
      "sourceUrl": "https://huggingface.co/rhasspy/piper-voices/tree/main/es/es_ES/sharvard/medium",
      "licenseExpression": "MIT AND CC-BY-3.0",
      "licenseUrl": "https://creativecommons.org/licenses/by/3.0/",
      "status": "attribution-required",
      "commercialUse": "allowed",
      "redistribution": "allowed-with-notice",
      "attribution": { "required": true, "text": "sHarvard Spanish speech dataset, University of Edinburgh DataShare 10283/574, CC BY 3.0; modelo distribuido por Piper Voices." },
      "notes": "La atribución debe acompañar cualquier distribución del modelo y conservarse en los avisos del producto."
    },
    {
      "resourceId": "voz-davefx-es-v1",
      "assetType": "voice",
      "origin": "third-party",
      "rightsHolder": "Contribuidores de Piper Voices y del dataset DaveFX",
      "sourceUrl": "https://huggingface.co/rhasspy/piper-voices/tree/main/es/es_ES/davefx/medium",
      "licenseExpression": "MIT AND CC0-1.0",
      "licenseUrl": "https://creativecommons.org/publicdomain/zero/1.0/",
      "status": "cleared",
      "commercialUse": "allowed",
      "redistribution": "allowed-with-notice",
      "attribution": { "required": false },
      "notes": "Conservar el aviso MIT del repositorio; el MODEL_CARD declara el dataset de origen CC0."
    },
    {
      "resourceId": "cartel-dato-v1",
      "assetType": "prop",
      "origin": "original",
      "rightsHolder": "Tomás Scorza",
      "licenseExpression": "LicenseRef-Proprietary-Asset",
      "status": "cleared",
      "commercialUse": "allowed",
      "redistribution": "product-only",
      "attribution": { "required": false },
      "notes": "Prop geométrico original; no se autoriza su venta como asset independiente."
    },
    {
      "resourceId": "telefono-social-claro-v1",
      "assetType": "prop",
      "origin": "original",
      "rightsHolder": "Tomás Scorza",
      "licenseExpression": "LicenseRef-Proprietary-Asset",
      "status": "cleared",
      "commercialUse": "allowed",
      "redistribution": "product-only",
      "attribution": { "required": false },
      "notes": "Prop geométrico original del paquete visual interno V1; no se autoriza su venta como asset independiente."
    },
    {
      "resourceId": "telefono-social-oscuro-v1",
      "assetType": "prop",
      "origin": "original",
      "rightsHolder": "Tomás Scorza",
      "licenseExpression": "LicenseRef-Proprietary-Asset",
      "status": "cleared",
      "commercialUse": "allowed",
      "redistribution": "product-only",
      "attribution": { "required": false },
      "notes": "Prop geométrico original del paquete visual interno V1; no se autoriza su venta como asset independiente."
    },
    {
      "resourceId": "globo-dialogo-coral-v1",
      "assetType": "prop",
      "origin": "original",
      "rightsHolder": "Tomás Scorza",
      "licenseExpression": "LicenseRef-Proprietary-Asset",
      "status": "cleared",
      "commercialUse": "allowed",
      "redistribution": "product-only",
      "attribution": { "required": false },
      "notes": "Prop geométrico original del paquete visual interno V1; no se autoriza su venta como asset independiente."
    },
    {
      "resourceId": "globo-dialogo-azul-v1",
      "assetType": "prop",
      "origin": "original",